{
  "schema": "ctx.resolve.v1",
  "path": "wiki/concepts/retry-policy.md",
  "strategy": "theirs",
  "previous_state": "conflict",
  "state": "unchanged",
  "base_sha": "94b52c8f9ade15c44e6750dfa93ff59529f19ec5",
  "file_written": true,
  "backup_file": ".sync/backup/wiki/concepts/retry-policy.md.20261015T093513Z",
  "warnings": []
}
